[
  {
    "field_id": "F0001",
    "date": "2026-09-01",
    "sensor": "S2",
    "ndvi": 0.801,
    "nbr": 0.606,
    "cloud_frac": 0.2,
    "n_pixels": 152,
    "synthetic": true
  },
  {
    "field_id": "F0001",
    "date": "2026-09-06",
    "sensor": "S2",
    "ndvi": 0.794,
    "nbr": 0.591,
    "cloud_frac": 0.17,
    "n_pixels": 217,
    "synthetic": true
  },
  {
    "field_id": "F0001",
    "date": "2026-09-11",
    "sensor": "S2",
    "ndvi": 0.794,
    "nbr": 0.63,
    "cloud_frac": 0.2,
    "n_pixels": 203,
    "synthetic": true
  },
  {
    "field_id": "F0001",
    "date": "2026-09-16",
    "sensor": "S2",
    "ndvi": 0.766,
    "nbr": 0.593,
    "cloud_frac": 0.19,
    "n_pixels": 151,
    "synthetic": true
  },
  {
    "field_id": "F0001",
    "date": "2026-09-21",
    "sensor": "S2",
    "ndvi": 0.812,
    "nbr": 0.614,
    "cloud_frac": 0.09,
    "n_pixels": 188,
    "synthetic": true
  },
  {
    "field_id": "F0001",
    "date": "2026-09-26",
    "sensor": "S2",
    "ndvi": 0.791,
    "nbr": 0.617,
    "cloud_frac": 0.12,
    "n_pixels": 28,
    "synthetic": true
  },
  {
    "field_id": "F0001",
    "date": "2026-10-01",
    "sensor": "S2",
    "ndvi": 0.774,
    "nbr": 0.577,
    "cloud_frac": 0.02,
    "n_pixels": 259,
    "synthetic": true
  },
  {
    "field_id": "F0001",
    "date": "2026-10-06",
    "sensor": "S2",
    "ndvi": 0.803,
    "nbr": 0.614,
    "cloud_frac": 0.17,
    "n_pixels": 98,
    "synthetic": true
  },
  {
    "field_id": "F0001",
    "date": "2026-10-11",
    "sensor": "S2",
    "ndvi": 0.803,
    "nbr": 0.613,
    "cloud_frac": 0.12,
    "n_pixels": 137,
    "synthetic": true
  },
  {
    "field_id": "F0001",
    "date": "2026-10-16",
    "sensor": "S2",
    "ndvi": 0.787,
    "nbr": 0.593,
    "cloud_frac": 0.03,
    "n_pixels": 247,
    "synthetic": true
  },
  {
    "field_id": "F0002",
    "date": "2026-09-01",
    "sensor": "S2",
    "ndvi": 0.776,
    "nbr": 0.61,
    "cloud_frac": 0.05,
    "n_pixels": 272,
    "synthetic": true
  },
  {
    "field_id": "F0002",
    "date": "2026-09-06",
    "sensor": "S2",
    "ndvi": 0.81,
    "nbr": 0.609,
    "cloud_frac": 0.13,
    "n_pixels": 160,
    "synthetic": true
  },
  {
    "field_id": "F0002",
    "date": "2026-09-11",
    "sensor": "S2",
    "ndvi": 0.798,
    "nbr": 0.592,
    "cloud_frac": 0.19,
    "n_pixels": 190,
    "synthetic": true
  },
  {
    "field_id": "F0002",
    "date": "2026-09-16",
    "sensor": "S2",
    "ndvi": 0.771,
    "nbr": 0.574,
    "cloud_frac": 0.29,
    "n_pixels": 121,
    "synthetic": true
  },
  {
    "field_id": "F0002",
    "date": "2026-09-21",
    "sensor": "S2",
    "ndvi": 0.808,
    "nbr": 0.582,
    "cloud_frac": 0.08,
    "n_pixels": 233,
    "synthetic": true
  },
  {
    "field_id": "F0002",
    "date": "2026-09-26",
    "sensor": "S2",
    "ndvi": 0.793,
    "nbr": 0.615,
    "cloud_frac": 0.13,
    "n_pixels": 291,
    "synthetic": true
  },
  {
    "field_id": "F0002",
    "date": "2026-10-01",
    "sensor": "S2",
    "ndvi": 0.796,
    "nbr": 0.581,
    "cloud_frac": 0.27,
    "n_pixels": 55,
    "synthetic": true
  },
  {
    "field_id": "F0002",
    "date": "2026-10-06",
    "sensor": "S2",
    "ndvi": 0.765,
    "nbr": 0.609,
    "cloud_frac": 0.17,
    "n_pixels": 147,
    "synthetic": true
  },
  {
    "field_id": "F0002",
    "date": "2026-10-11",
    "sensor": "S2",
    "ndvi": 0.788,
    "nbr": 0.571,
    "cloud_frac": 0.23,
    "n_pixels": 157,
    "synthetic": true
  },
  {
    "field_id": "F0002",
    "date": "2026-10-16",
    "sensor": "S2",
    "ndvi": 0.805,
    "nbr": 0.6,
    "cloud_frac": 0.18,
    "n_pixels": 221,
    "synthetic": true
  },
  {
    "field_id": "F0003",
    "date": "2026-09-01",
    "sensor": "S2",
    "ndvi": 0.795,
    "nbr": 0.58,
    "cloud_frac": 0.12,
    "n_pixels": 240,
    "synthetic": true
  },
  {
    "field_id": "F0003",
    "date": "2026-09-06",
    "sensor": "S2",
    "ndvi": 0.827,
    "nbr": 0.617,
    "cloud_frac": 0.04,
    "n_pixels": 31,
    "synthetic": true
  },
  {
    "field_id": "F0003",
    "date": "2026-09-11",
    "sensor": "S2",
    "ndvi": 0.829,
    "nbr": 0.576,
    "cloud_frac": 0.05,
    "n_pixels": 103,
    "synthetic": true
  },
  {
    "field_id": "F0003",
    "date": "2026-09-16",
    "sensor": "S2",
    "ndvi": 0.792,
    "nbr": 0.572,
    "cloud_frac": 0.18,
    "n_pixels": 279,
    "synthetic": true
  },
  {
    "field_id": "F0003",
    "date": "2026-09-21",
    "sensor": "S2",
    "ndvi": 0.796,
    "nbr": 0.571,
    "cloud_frac": 0.14,
    "n_pixels": 150,
    "synthetic": true
  },
  {
    "field_id": "F0003",
    "date": "2026-09-26",
    "sensor": "S2",
    "ndvi": 0.817,
    "nbr": 0.64,
    "cloud_frac": 0.15,
    "n_pixels": 239,
    "synthetic": true
  },
  {
    "field_id": "F0003",
    "date": "2026-10-01",
    "sensor": "S2",
    "ndvi": 0.808,
    "nbr": 0.58,
    "cloud_frac": 0.14,
    "n_pixels": 246,
    "synthetic": true
  },
  {
    "field_id": "F0003",
    "date": "2026-10-06",
    "sensor": "S2",
    "ndvi": 0.784,
    "nbr": 0.592,
    "cloud_frac": 0.13,
    "n_pixels": 94,
    "synthetic": true
  },
  {
    "field_id": "F0003",
    "date": "2026-10-11",
    "sensor": "S2",
    "ndvi": 0.797,
    "nbr": 0.621,
    "cloud_frac": 0.27,
    "n_pixels": 171,
    "synthetic": true
  },
  {
    "field_id": "F0003",
    "date": "2026-10-16",
    "sensor": "S2",
    "ndvi": 0.779,
    "nbr": 0.567,
    "cloud_frac": 0.2,
    "n_pixels": 59,
    "synthetic": true
  },
  {
    "field_id": "F0004",
    "date": "2026-09-01",
    "sensor": "S2",
    "ndvi": 0.799,
    "nbr": 0.635,
    "cloud_frac": 0.23,
    "n_pixels": 109,
    "synthetic": true
  },
  {
    "field_id": "F0004",
    "date": "2026-09-06",
    "sensor": "S2",
    "ndvi": 0.79,
    "nbr": 0.576,
    "cloud_frac": 0.01,
    "n_pixels": 50,
    "synthetic": true
  },
  {
    "field_id": "F0004",
    "date": "2026-09-11",
    "sensor": "S2",
    "ndvi": 0.785,
    "nbr": 0.643,
    "cloud_frac": 0.25,
    "n_pixels": 148,
    "synthetic": true
  },
  {
    "field_id": "F0004",
    "date": "2026-09-16",
    "sensor": "S2",
    "ndvi": 0.782,
    "nbr": 0.619,
    "cloud_frac": 0.09,
    "n_pixels": 246,
    "synthetic": true
  },
  {
    "field_id": "F0004",
    "date": "2026-09-21",
    "sensor": "S2",
    "ndvi": 0.797,
    "nbr": 0.599,
    "cloud_frac": 0.28,
    "n_pixels": 70,
    "synthetic": true
  },
  {
    "field_id": "F0004",
    "date": "2026-09-26",
    "sensor": "S2",
    "ndvi": 0.791,
    "nbr": 0.575,
    "cloud_frac": 0.3,
    "n_pixels": 66,
    "synthetic": true
  },
  {
    "field_id": "F0004",
    "date": "2026-10-01",
    "sensor": "S2",
    "ndvi": 0.803,
    "nbr": 0.632,
    "cloud_frac": 0.27,
    "n_pixels": 82,
    "synthetic": true
  },
  {
    "field_id": "F0004",
    "date": "2026-10-06",
    "sensor": "S2",
    "ndvi": 0.806,
    "nbr": 0.626,
    "cloud_frac": 0.23,
    "n_pixels": 270,
    "synthetic": true
  },
  {
    "field_id": "F0004",
    "date": "2026-10-11",
    "sensor": "S2",
    "ndvi": 0.792,
    "nbr": 0.622,
    "cloud_frac": 0.03,
    "n_pixels": 226,
    "synthetic": true
  },
  {
    "field_id": "F0004",
    "date": "2026-10-16",
    "sensor": "S2",
    "ndvi": 0.804,
    "nbr": 0.576,
    "cloud_frac": 0.07,
    "n_pixels": 229,
    "synthetic": true
  },
  {
    "field_id": "F0005",
    "date": "2026-09-01",
    "sensor": "S2",
    "ndvi": 0.833,
    "nbr": 0.634,
    "cloud_frac": 0.05,
    "n_pixels": 229,
    "synthetic": true
  },
  {
    "field_id": "F0005",
    "date": "2026-09-06",
    "sensor": "S2",
    "ndvi": 0.829,
    "nbr": 0.578,
    "cloud_frac": 0.09,
    "n_pixels": 70,
    "synthetic": true
  },
  {
    "field_id": "F0005",
    "date": "2026-09-11",
    "sensor": "S2",
    "ndvi": 0.813,
    "nbr": 0.592,
    "cloud_frac": 0.15,
    "n_pixels": 141,
    "synthetic": true
  },
  {
    "field_id": "F0005",
    "date": "2026-09-16",
    "sensor": "S2",
    "ndvi": 0.807,
    "nbr": 0.628,
    "cloud_frac": 0.04,
    "n_pixels": 60,
    "synthetic": true
  },
  {
    "field_id": "F0005",
    "date": "2026-09-21",
    "sensor": "S2",
    "ndvi": 0.813,
    "nbr": 0.559,
    "cloud_frac": 0.15,
    "n_pixels": 279,
    "synthetic": true
  },
  {
    "field_id": "F0005",
    "date": "2026-09-26",
    "sensor": "S2",
    "ndvi": 0.776,
    "nbr": 0.582,
    "cloud_frac": 0.24,
    "n_pixels": 214,
    "synthetic": true
  },
  {
    "field_id": "F0005",
    "date": "2026-10-01",
    "sensor": "S2",
    "ndvi": 0.818,
    "nbr": 0.573,
    "cloud_frac": 0.04,
    "n_pixels": 141,
    "synthetic": true
  },
  {
    "field_id": "F0005",
    "date": "2026-10-06",
    "sensor": "S2",
    "ndvi": 0.81,
    "nbr": 0.59,
    "cloud_frac": 0.09,
    "n_pixels": 54,
    "synthetic": true
  },
  {
    "field_id": "F0005",
    "date": "2026-10-11",
    "sensor": "S2",
    "ndvi": 0.82,
    "nbr": 0.611,
    "cloud_frac": 0.29,
    "n_pixels": 165,
    "synthetic": true
  },
  {
    "field_id": "F0005",
    "date": "2026-10-16",
    "sensor": "S2",
    "ndvi": 0.786,
    "nbr": 0.596,
    "cloud_frac": 0.17,
    "n_pixels": 100,
    "synthetic": true
  },
  {
    "field_id": "F0006",
    "date": "2026-09-01",
    "sensor": "S2",
    "ndvi": 0.804,
    "nbr": 0.578,
    "cloud_frac": 0.04,
    "n_pixels": 229,
    "synthetic": true
  },
  {
    "field_id": "F0006",
    "date": "2026-09-06",
    "sensor": "S2",
    "ndvi": 0.85,
    "nbr": 0.638,
    "cloud_frac": 0.28,
    "n_pixels": 137,
    "synthetic": true
  },
  {
    "field_id": "F0006",
    "date": "2026-09-11",
    "sensor": "S2",
    "ndvi": 0.794,
    "nbr": 0.571,
    "cloud_frac": 0.24,
    "n_pixels": 257,
    "synthetic": true
  },
  {
    "field_id": "F0006",
    "date": "2026-09-16",
    "sensor": "S2",
    "ndvi": 0.824,
    "nbr": 0.585,
    "cloud_frac": 0.24,
    "n_pixels": 24,
    "synthetic": true
  },
  {
    "field_id": "F0006",
    "date": "2026-09-21",
    "sensor": "S2",